{
  "spec_version": "1.0",
  "sources": {
    "documentation": {
      "file": "Architecture_Documentation.md",
      "sha256": "6855cebc7fe63f643172f9419540a0c8f74e5ee728766bc39006362734623e94"
    },
    "views": {
      "file": "Architecture_View.md",
      "sha256": "d8977790af9a015f26128021e89a76d60509923d424659fea95f9c91fc0da6e9"
    }
  },
  "target_platform": {
    "kind": "desktop",
    "os": "Windows",
    "gui": "tkinter",
    "language": "Python 3.11+",
    "dependencies": "Python standard library only (see bundled module list) + pytest for tests",
    "persistence": "SQLite file",
    "users": "single local user per session",
    "source": "Task constraint: the deliverable must be a Windows desktop application, not web-based."
  },
  "domain_model": {
    "actors": [
      "Admin",
      "End User"
    ],
    "use_cases": [
      {
        "actor": "End User",
        "use_case": "Play Game"
      },
      {
        "actor": "End User",
        "use_case": "View Score"
      },
      {
        "actor": "End User",
        "use_case": "View Help"
      },
      {
        "actor": "Admin",
        "use_case": "Update Questions"
      }
    ],
    "classes": [
      {
        "name": "Game",
        "attributes": [
          {
            "name": "id",
            "type": "string",
            "visibility": "private"
          },
          {
            "name": "score",
            "type": "int",
            "visibility": "private"
          }
        ],
        "methods": [
          {
            "name": "play",
            "params": [],
            "returns": "void",
            "visibility": "public"
          },
          {
            "name": "viewScore",
            "params": [],
            "returns": "int",
            "visibility": "public"
          }
        ]
      },
      {
        "name": "Question",
        "attributes": [
          {
            "name": "id",
            "type": "string",
            "visibility": "private"
          },
          {
            "name": "prompt",
            "type": "string",
            "visibility": "private"
          },
          {
            "name": "options",
            "type": "List<string>",
            "visibility": "private"
          }
        ],
        "methods": [
          {
            "name": "getPrompt",
            "params": [],
            "returns": "string",
            "visibility": "public"
          },
          {
            "name": "getOptions",
            "params": [],
            "returns": "List<string>",
            "visibility": "public"
          }
        ]
      },
      {
        "name": "User",
        "attributes": [
          {
            "name": "id",
            "type": "string",
            "visibility": "private"
          },
          {
            "name": "username",
            "type": "string",
            "visibility": "private"
          }
        ],
        "methods": [
          {
            "name": "playGame",
            "params": [
              "game: Game"
            ],
            "returns": "void",
            "visibility": "public"
          },
          {
            "name": "viewScore",
            "params": [
              "game: Game"
            ],
            "returns": "int",
            "visibility": "public"
          }
        ]
      },
      {
        "name": "Admin",
        "attributes": [
          {
            "name": "id",
            "type": "string",
            "visibility": "private"
          },
          {
            "name": "username",
            "type": "string",
            "visibility": "private"
          }
        ],
        "methods": [
          {
            "name": "updateQuestions",
            "params": [
              "questions: List<Question>"
            ],
            "returns": "void",
            "visibility": "public"
          }
        ]
      }
    ],
    "class_relations": [
      "Game --* Question (composition)",
      "User --* Game (composition)",
      "Admin --* Question (composition)"
    ],
    "states": [
      "Playing",
      "Paused",
      "GameOver"
    ],
    "transitions": [
      {
        "from": "[*]",
        "to": "Playing",
        "trigger": null
      },
      {
        "from": "Playing",
        "to": "Paused",
        "trigger": "pause()"
      },
      {
        "from": "Paused",
        "to": "Playing",
        "trigger": "resume()"
      },
      {
        "from": "Playing",
        "to": "GameOver",
        "trigger": "gameOver()"
      }
    ],
    "activity": [
      {
        "step": "start",
        "branch": null
      },
      {
        "step": "action",
        "text": "play game"
      },
      {
        "step": "if",
        "condition": "game over?",
        "branch": "yes"
      },
      {
        "step": "action",
        "text": "game over"
      },
      {
        "step": "else",
        "branch": "no"
      },
      {
        "step": "action",
        "text": "continue playing"
      },
      {
        "step": "endif",
        "branch": null
      },
      {
        "step": "action",
        "text": "calculate score"
      },
      {
        "step": "action",
        "text": "display score"
      },
      {
        "step": "stop",
        "branch": null
      }
    ],
    "sequences": [
      {
        "name": "SequenceDiagram1",
        "messages": [
          "User -> Game: play()",
          "Game -> Question: getPrompt()",
          "Question -> Game: return prompt",
          "Game -> User: display prompt",
          "User -> Game: submit answer",
          "Game -> Question: check answer",
          "Question -> Game: return result",
          "Game -> User: display result"
        ]
      },
      {
        "name": "SequenceDiagram2",
        "messages": [
          "Admin -> Question: update()",
          "Question -> Admin: return success"
        ]
      }
    ],
    "packages": {
      "Game": [
        "Game",
        "Question"
      ],
      "User": [
        "User"
      ],
      "Admin": [
        "Admin"
      ]
    },
    "components": [
      "AdminComponent",
      "GameComponent",
      "QuestionComponent",
      "UserComponent"
    ],
    "implied_features": [
      "introductory movie",
      "main menu",
      "series of fraction questions",
      "ending scene with feedback"
    ]
  },
  "requirements": [
    {
      "id": "ASR-1",
      "type": "ASR",
      "short_text": "Data durability",
      "diagrams": [
        "DeploymentDiagram"
      ],
      "components": [
        "QuestionComponent"
      ],
      "artifacts": [
        "sql/question_ddl.sql"
      ],
      "rationale": "Ensures that question data is persisted and recoverable",
      "mentioned_in": [
        "A",
        "B",
        "D",
        "J"
      ]
    },
    {
      "id": "ASR-2",
      "type": "ASR",
      "short_text": "",
      "diagrams": [],
      "components": [],
      "artifacts": [],
      "rationale": "",
      "mentioned_in": [
        "A",
        "D",
        "J"
      ]
    },
    {
      "id": "FR-1",
      "type": "FR",
      "short_text": "Play game",
      "diagrams": [
        "UseCaseDiagram"
      ],
      "components": [
        "GameComponent"
      ],
      "artifacts": [
        "openapi.yaml"
      ],
      "rationale": "Allows users to play the game",
      "mentioned_in": [
        "B"
      ]
    },
    {
      "id": "NFR-1",
      "type": "NFR",
      "short_text": "Performance",
      "diagrams": [
        "SequenceDiagram1"
      ],
      "components": [
        "GameComponent"
      ],
      "artifacts": [
        "internal.proto"
      ],
      "rationale": "Ensures the game responds quickly to user input",
      "mentioned_in": [
        "A",
        "B",
        "D",
        "J"
      ]
    }
  ],
  "input_issues": [
    {
      "code": "EMPTY_TABLE",
      "severity": "high",
      "message": "Table under 'Matrix mapping Unit / Integration / Contract / E2E / Chaos tests to components' has headers but every cell is empty."
    },
    {
      "code": "ARTIFACT_MISMATCH",
      "severity": "medium",
      "message": "ASR-1 references 'sql/question_ddl.sql' but the deliverables list does not contain it (deliverables: k8s/spacefractions-deployment.yaml, sql/game_ddl.sql)."
    },
    {
      "code": "THIN_REQUIREMENTS",
      "severity": "high",
      "message": "Only 4 requirement ids exist (ASR-1, ASR-2, FR-1, NFR-1); features from the summary (introductory movie, main menu, series of fraction questions, ending scene with feedback) have no FR of their own."
    },
    {
      "code": "UNTRACED_REQUIREMENT",
      "severity": "medium",
      "message": "Not in the traceability matrix: ASR-2."
    },
    {
      "code": "GENERIC_JUSTIFICATIONS",
      "severity": "medium",
      "message": "12 technology choices share only 3 copy-pasted justifications (e.g. 'meets ASR-1 (data durability)' for Jenkins 2-3)."
    },
    {
      "code": "DUPLICATE_BLOCKS",
      "severity": "low",
      "message": "4 code block(s) appear more than once verbatim."
    },
    {
      "code": "PLATFORM_CONFLICT",
      "severity": "high",
      "message": "Document targets a web/cloud microservice system (web-based, microservices, Node.js, Express.js, PostgreSQL, Redis, RabbitMQ, Elasticsearch, OAuth2, Prometheus…) but the required deliverable is a single-user desktop application."
    },
    {
      "code": "UML_SYNTAX",
      "severity": "low",
      "message": "ObjectDiagram: Object diagram uses 'participant' (sequence syntax) instead of 'object'; participants treated as objects."
    },
    {
      "code": "UML_SYNTAX",
      "severity": "low",
      "message": "SequenceDiagram1: 8 Mermaid-style '->>' arrow(s) are not PlantUML; normalised to '->'."
    },
    {
      "code": "UML_SYNTAX",
      "severity": "low",
      "message": "SequenceDiagram2: 2 Mermaid-style '->>' arrow(s) are not PlantUML; normalised to '->'."
    },
    {
      "code": "UML_SYNTAX",